{
  "$schema": "https://json-schema.org/draft/2020-12/schema",
  "$id": "https://orbital-stellar.io/schema/attestation.schema.json",
  "title": "AttestationDocument",
  "description": "A claim (SEP §7.3) that a deployed contract emits a given SEP-48-shaped event schema. Exists for contracts deployed before SEP-48/CAP-67, which have no embedded contract spec this could otherwise be derived from. Signature-envelope concerns (who signed it, tamper detection) are a separate layer - see SEP §7.4.",
  "type": "object",
  "required": ["contractId", "executableKind", "events", "attester", "createdAt"],
  "additionalProperties": false,
  "allOf": [
    {
      "if": {
        "properties": { "executableKind": { "const": "wasm" } }
      },
      "then": {
        "required": ["wasmHash"]
      },
      "else": {
        "not": { "required": ["wasmHash"] }
      }
    }
  ],
  "properties": {
    "contractId": {
      "type": "string",
      "description": "Bech32-encoded Soroban contract address (C…) the attestation is about.",
      "pattern": "^C[A-Z2-7]{55}$"
    },
    "executableKind": {
      "type": "string",
      "description": "What kind of executable the attested contract runs, mirroring the on-chain ContractExecutable XDR union. \"wasm\" contracts have a deployed WASM blob and a wasmHash; \"stellarAsset\" contracts (SACs) run the network's built-in executable and have no WASM to hash.",
      "enum": ["wasm", "stellarAsset"]
    },
    "wasmHash": {
      "type": "string",
      "description": "Hex-encoded SHA-256 hash of the attested contract's deployed WASM bytecode. Required when executableKind is \"wasm\"; must be absent when it's \"stellarAsset\".",
      "pattern": "^[0-9a-fA-F]{64}$"
    },
    "events": {
      "type": "array",
      "description": "The SEP-48-shaped event definitions being attested to.",
      "items": { "$ref": "#/$defs/EventSpec" }
    },
    "attester": {
      "type": "string",
      "description": "Stellar account address (G…) of the party making this attestation. Must match the signing key in the SEP §7.4 envelope wrapping this document.",
      "pattern": "^G[A-Z2-7]{55}$"
    },
    "createdAt": {
      "type": "string",
      "description": "ISO 8601 timestamp of when the attestation was made.",
      "format": "date-time"
    },
    "expiresAt": {
      "type": "string",
      "description": "ISO 8601 timestamp after which the attestation should no longer be trusted.",
      "format": "date-time"
    },
    "supersedes": {
      "type": "string",
      "description": "Hex-encoded hash of a prior attestation document this one supersedes.",
      "pattern": "^[0-9a-fA-F]{64}$"
    }
  },
  "$defs": {
    "PrimitiveType": {
      "type": "string",
      "description": "An atomic Soroban scalar type. Mirrors `schema/spec.schema.json`'s definition of the same name.",
      "enum": [
        "bool",
        "u32",
        "i32",
        "u64",
        "i64",
        "u128",
        "i128",
        "u256",
        "i256",
        "bytes",
        "string",
        "symbol",
        "address",
        "void",
        "error"
      ]
    },
    "BytesNType": {
      "type": "object",
      "description": "A fixed-length byte array, e.g. bytes_n<32>.",
      "required": ["type", "size"],
      "additionalProperties": false,
      "properties": {
        "type": { "const": "bytes_n" },
        "size": { "type": "integer", "minimum": 1, "maximum": 64 }
      }
    },
    "OptionType": {
      "type": "object",
      "description": "A Soroban Option<T> - a value that may be present or absent.",
      "required": ["type", "inner"],
      "additionalProperties": false,
      "properties": {
        "type": { "const": "option" },
        "inner": { "$ref": "#/$defs/TypeSpec" }
      }
    },
    "ResultType": {
      "type": "object",
      "description": "A Soroban Result<T, E> - either Ok(T) or Err(E).",
      "required": ["type", "ok", "err"],
      "additionalProperties": false,
      "properties": {
        "type": { "const": "result" },
        "ok": { "$ref": "#/$defs/TypeSpec" },
        "err": { "$ref": "#/$defs/TypeSpec" }
      }
    },
    "VecType": {
      "type": "object",
      "description": "A homogeneous variable-length sequence.",
      "required": ["type", "item"],
      "additionalProperties": false,
      "properties": {
        "type": { "const": "vec" },
        "item": { "$ref": "#/$defs/TypeSpec" }
      }
    },
    "MapType": {
      "type": "object",
      "description": "An ordered key-value map.",
      "required": ["type", "key", "value"],
      "additionalProperties": false,
      "properties": {
        "type": { "const": "map" },
        "key": { "$ref": "#/$defs/TypeSpec" },
        "value": { "$ref": "#/$defs/TypeSpec" }
      }
    },
    "TupleType": {
      "type": "object",
      "description": "A fixed-length heterogeneous sequence (Soroban Tuple). Minimum 2 elements.",
      "required": ["type", "elements"],
      "additionalProperties": false,
      "properties": {
        "type": { "const": "tuple" },
        "elements": {
          "type": "array",
          "items": { "$ref": "#/$defs/TypeSpec" },
          "minItems": 2
        }
      }
    },
    "NamedType": {
      "type": "object",
      "description": "A reference to a user-defined type declared in the attested contract's own ContractSpec.types.",
      "required": ["type", "name"],
      "additionalProperties": false,
      "properties": {
        "type": { "const": "named" },
        "name": { "type": "string", "minLength": 1 }
      }
    },
    "TypeSpec": {
      "description": "Union of every representable Soroban type. Either a primitive string literal or a tagged-object composite type.",
      "oneOf": [
        { "$ref": "#/$defs/PrimitiveType" },
        { "$ref": "#/$defs/BytesNType" },
        { "$ref": "#/$defs/OptionType" },
        { "$ref": "#/$defs/ResultType" },
        { "$ref": "#/$defs/VecType" },
        { "$ref": "#/$defs/MapType" },
        { "$ref": "#/$defs/TupleType" },
        { "$ref": "#/$defs/NamedType" }
      ]
    },
    "FieldSpec": {
      "type": "object",
      "description": "A named, typed field used in an event's topics or data.",
      "required": ["name", "type"],
      "additionalProperties": false,
      "properties": {
        "name": {
          "type": "string",
          "minLength": 1,
          "pattern": "^[a-zA-Z_][a-zA-Z0-9_]*$"
        },
        "type": { "$ref": "#/$defs/TypeSpec" },
        "doc": { "type": "string" }
      }
    },
    "EventSpec": {
      "type": "object",
      "description": "Specification of one event the attested contract emits via env.events().publish().",
      "required": ["name", "topics", "data"],
      "additionalProperties": false,
      "properties": {
        "name": { "type": "string", "minLength": 1 },
        "doc": { "type": "string" },
        "topics": {
          "type": "array",
          "description": "Ordered topic ScVal descriptors. The first topic is conventionally the event-name Symbol.",
          "items": { "$ref": "#/$defs/FieldSpec" }
        },
        "data": {
          "type": "array",
          "description": "Ordered payload data fields emitted alongside the topics.",
          "items": { "$ref": "#/$defs/FieldSpec" }
        }
      }
    }
  }
}
